[
  {
    "title": "Bratkartoffeln",
    "summary": "",
    "duration": "~10min",
    "tags": [
      "easy",
      "warm",
      "herd"
    ],
    "images": [],
    "personCount": 2,
    "url": "https://www.gaumenfreundin.de/bratkartoffeln-einfach-und-knusprig",
    "ingredients": [
      {
        "title": "Kartoffeln von zu Hause",
        "unit": "kg",
        "amount": "0.5"
      },
      {
        "title": "Butterschmalz oder Pflanzen√∂l",
        "unit": "g",
        "amount": "25"
      },
      {
        "title": "Salz und Pfeffer"
      }
    ]
  }
]